"457","11 March 2019 4:06:54 pm","Russell","Ryan","Space Telescope Science Institute","The WFIRST Deep Grism Survey: WDGS","We present several science questions that require a deep grism program with the Wide-Field Infrared Survey Telescope. ","http://surveygizmoresponseuploads.s3.amazonaws.com/fileuploads/623127/4458621/118-7fcb835a831ce211dd25fffd3518841f_RyanRussellE.pdf"
"458","11 March 2019 4:07:12 pm","Chester","Harman","Columbia University","A Balancing Act: Biosignature and Anti-Biosignature Studies in the Next Decade and Beyond","This white paper elaborates on the need for a quantitative biosignature identification and assessment framework to produce a numerical estimate for the likelihood that a given world has life. This will provide a comprehensive means to weigh planetary habitability alongside potential biosignatures and their respective false positives. ","http://surveygizmoresponseuploads.s3.amazonaws.com/fileuploads/623127/4458621/118-d4e777f0605e5eb310c9174c0cb7ecd3_HarmanChesterE.docx"
"459","11 March 2019 4:07:51 pm","Q. Daniel","Wang","University of Massachusetts Amherst","The Panchromatic Circumgalactic Medium","The circumgalactic medium (CGM)  is empirically multi-phased and complex in dynamics. We review progress and open questions specific for the hot component, magnetic fields and cosmic rays, the cool, warm, and dusty components, and conclude with open questions primarily regarding the interplay among different components.  ","http://surveygizmoresponseuploads.s3.amazonaws.com/fileuploads/623127/4458621/132-80e77c56ccc8466fbcbf9d52c078296a_WangQ.Daniel.pdf"
"460","11 March 2019 7:54:25 pm","Robert","Zellem","Jet Propulsion Laboratory, California Institute of Technology","Engaging Citizen Scientists to Keep Transit Times Fresh and Ensure the Efficient Use of Transiting Exoplanet Characterization Missions","This white paper advocates for the creation of a community-wide program to maintain precise mid-transit times of exoplanets that would likely be targeted by future exoplanet characterization platforms. Given the numerous targets that will require careful monitoring, this network will initially be devised as a citizen science project.","http://surveygizmoresponseuploads.s3.amazonaws.com/fileuploads/623127/4458621/96-d7d69da632b86850da30f004da6ac9bb_ETS_final.pdf"
"461","11 March 2019 4:08:22 pm","Rachel","Osten","Space Telescope Science Institute, Johns Hopkins University","Advancing Understanding of Star-Planet Ecosystems in the Next Decade: The Radio Wavelength Perspective","In this white paper we advocate for stellar radio observations as a way to advance understanding of stars in service of a better understanding of star-planet ecosystems.  Specific key advances needed are sensitivity and access to a broader range of frequency space to make progress in understanding the space weather environments of exoplanets.   ","http://surveygizmoresponseuploads.s3.amazonaws.com/fileuploads/623127/4458621/185-f1000a6b079d611f7483164033b83ff1_OstenRachelA2.pdf"
"462","11 March 2019 4:08:31 pm","Bjorn","Emonts","National Radio Astronomy Observatory","The Radio Universe at Low Surface Brightness: Feedback & accretion in the circumgalactic medium","The low-surface-brightness radio regime offers two novel science cases that will help understand the role of the high-z CGM in galaxy evolution: observing the cold molecular medium on scales of galaxy halos and tracing feedback through the Sunyaev-Zeldovich Effect onto the hot CGM. Compact mm interferometers will explore these new science fields.","http://surveygizmoresponseuploads.s3.amazonaws.com/fileuploads/623127/4458621/28-1911d830ebd4117517c859f328407418_EmontsBjorn.pdf"
"463","11 March 2019 4:09:11 pm","Tim","Eifler","University of Arizona","Partnering space and ground observatories - Synergies in cosmology from LSST and WFIRST","We recommend the exploration of joint survey strategies that combine the two top-ranked survey endeavors of the 2010 Decadal Survey, the ground-based Large Synoptic Survey Telescope (LSST) and the space-based Wide Field Infrared Survey Telescope (WFIRST). We detail  several joint survey scenarios and quantify the information gain for cosmology.","http://surveygizmoresponseuploads.s3.amazonaws.com/fileuploads/623127/4458621/185-080e528ea94e9067bc919d1440c2e89a_EiflerTim.pdf"
"464","11 March 2019 4:09:46 pm","Kate","Su","Steward Observatory, University of Arizona","Probing Unseen Planet Populations with Resolved Debris Disk Structures","This white paper focuses on resolving debris structures in thermal emission that is applicable to a large unbiased sample. We summarize the properties of the known debris disks and assess the feasibility of resolving them within our current and future infrared and millimeter facilities by adopting uniform criteria. ","http://surveygizmoresponseuploads.s3.amazonaws.com/fileuploads/623127/4458621/238-c71f7d662f30fdda6ee6e0730aba1838_SuKateYL.pdf"
"465","11 March 2019 4:09:59 pm","Vikram","Ravi","Center for Astrophysics | Harvard & Smithsonian; Caltech","Fast Radio Burst Tomography of the Unseen Universe","The discovery of Fast Radio Bursts (FRBs) at cosmological distances has opened a powerful window on otherwise unseen matter in the Universe. Observations of >10^4 FRBs will assess the baryon contents and physical conditions in the hot/diffuse circumgalactic, intracluster, and intergalactic medium, and test extant compact-object dark matter models.","http://surveygizmoresponseuploads.s3.amazonaws.com/fileuploads/623127/4458621/28-adf50e8eab168a4d02336a4a568b47b1_RaviVikram.pdf"
"466","11 March 2019 4:10:05 pm","Martin","Barstow","University of Leicester","White dwarfs as probes of fundamental astrophysics","Important topics that rely on studies and observations of white dwarfs but provide insight into other areas of astrophysics.","http://surveygizmoresponseuploads.s3.amazonaws.com/fileuploads/623127/4458621/37-ae13ec5aa4b168269cf8946c88127ec5_BarstowMartinA.pdf"
"467","11 March 2019 4:12:01 pm","Diana","Dragomir","MIT","Characterizing the Atmospheres of Irradiated Exoplanets at High Spectral Resolution","We describe the potential of high-resolution cross-correlation spectroscopy on the Extremely Large Telescopes to 1) robustly measure atmospheric circulation and planetary rotation for hot Jupiters, and 2) measure atmospheric mass-loss and extract atmospheric composition information for sub-Neptunes, super-Earths and disintegrating planets.","http://surveygizmoresponseuploads.s3.amazonaws.com/fileuploads/623127/4458621/28-220680267865c89947a917e7bcdba19e_DragomirDiana.pdf"
"468","11 March 2019 4:11:43 pm","Eric","Huff","Jet Propulsion Laboratory","Galaxy Kinematics and the Future of Dark Energy","We describe how galaxy kinematics can be used to greatly reduce statistical and systematic errors in weak lensing. We point out the ways in which these gains could allow kinematic lensing surveys to go beyond the limits on what is achievable with current methods, and we advocate for support for studies and instrumentation to advance the method.","http://surveygizmoresponseuploads.s3.amazonaws.com/fileuploads/623127/4458621/185-c812e8a416b4b6be8c401b5002481bdd_Mass_and_Motion_v3.pdf"
"469","11 March 2019 4:12:14 pm","Lynn D.","Matthews","Massachusetts Institute of Technology Haystack Observatory","Unlocking the Secrets of Late-Stage Stellar Evolution and Mass Loss through Radio Wavelength Imaging","Many details concerning the physics of late-stage stellar mass loss remain poorly understood.  Observations at cm, mm, and sub-mm wavelengths that  resolve the radio surfaces and extended atmospheres of evolved stars in space, time, and frequency  are poised to provide groundbreaking new insights into these questions in the coming decade.","http://surveygizmoresponseuploads.s3.amazonaws.com/fileuploads/623127/4458621/37-14416a24ba78925b41a6147c774c0d24_MatthewsLynnD2.pdf"
"470","11 March 2019 4:12:22 pm","Emmanuel","Fonseca","McGill University","Fundamental Physics with Radio Millisecond Pulsars","We summarize the state of the art and future directions in using millisecond radio pulsars to test gravitation and measure intrinsic, fundamental parameters of neutron stars.  ","http://surveygizmoresponseuploads.s3.amazonaws.com/fileuploads/623127/4458621/100-e33b2e01346bb624397d65e8cf8adcb8_FonsecaEmmanuel.pdf"
"471","11 March 2019 4:12:53 pm","Gregory","Fleishman","New Jersey Institute of Technology","Solar Coronal Magnetic Fields: Quantitative Measurements at Radio Wavelengths","Quantitative measurements of coronal and chromospheric magnetic field is currently in its infancy. We describe a foundation of such observations , which is a key input for MHD numerical models of the solar atmosphere and eruptive processes, and a key link between lower layers of the solar atmosphere and the heliosphere.","http://surveygizmoresponseuploads.s3.amazonaws.com/fileuploads/623127/4458621/188-3ba80ce04d50902b86c4411a739ef949_FleishmanGregoryD.pdf"
"472","11 March 2019 4:13:44 pm","Stefano","Ciprini","INFN Rome Tor Vergata and ASI Space Science Data Center ASI, Rome, Italy","Gravitationally Lensed MeV Gamma-ray Blazars","Gravitationally lensed gamma-ray blazars have large redshifts, huge BHs, powerful MeV photon-energy radiation. The pivotal MeV Universe is readyu for exploitation: lensed MeV blazars are rich multifreq./multimessenger laboratories (jet/central-engine spatial resolution, gamma rays/cosmic neutrinos/massive axions fluence enhancement and interference","http://surveygizmoresponseuploads.s3.amazonaws.com/fileuploads/623127/4458621/118-a26ae1b3d6792f304e715469b4ca9795_CipriniStefano.pdf"
"473","11 March 2019 4:14:17 pm","Anthony","Remijan","National Radio Astronomy Observatory","OBSERVATIONAL ASTROCHEMISTRY IN THE NEXT DECADE","In order to continue to make progress in how the chemical and physical nature of molecular material changes as we move from the diffuse interstellar medium to compact cores and eventually disks with planetary systems, as a community, we need observations of large astronomical molecules over large spatial scales and bandwidths.","http://surveygizmoresponseuploads.s3.amazonaws.com/fileuploads/623127/4458621/198-15682291cf06fc94fb6dbf8da1ed7d65_RemijanAnthonyJ.pdf"
"474","11 March 2019 4:15:35 pm","Francesca","Civano","Center for Astrophysics | Harvard & Smithsonian","Cosmic evolution of supermassive black holes: A view into the next two decades","Discoveries over the past 20 years by Chandra and XMM-Newton surveys have significantly enhanced our view of supermassive black hole (SMBH) and galaxy evolution. We discuss new and exciting questions on the cosmic growth of SMBHs that can be addressed by new X-ray and multiwavelength observatories in the next two decades.","http://surveygizmoresponseuploads.s3.amazonaws.com/fileuploads/623127/4458621/188-52d1e9ab89eab82d99fc5563d437972e_CivanoFrancesca.pdf"
"476","11 March 2019 4:16:12 pm","Eric","Murphy","National Radio Astronomy Observatory","Unsolved Problems in Modern Astrophysics: Anomalous Microwave Emission","This white paper discusses potential ways to improve our understanding of anomalous microwave emission (AME), requiring new facilities.  AME has remained a  major foreground contaminant in  CMB studies since first being discovered over 20 years ago, yet its physical origin remains an unsolved problem in modern astrophysics.","http://surveygizmoresponseuploads.s3.amazonaws.com/fileuploads/623127/4458621/184-b2acdb51506c3d3b88e98f66583b1d55_Astro2020_AME_WP-submitted.pdf"
"477","11 March 2019 4:16:39 pm","Roopesh","Ojha","UMBC/NASA GSFC","Neutrinos, Cosmic Rays, and the MeV Band","The Mev band holds the key to answering three astrophysical questions: the sites where cosmic Rays are produced and accelerated, the origins of high-energy neutrinos, and the physical mechanisms producing the high energy gamma-ray emission from blazars. Theoretical and experimental capabilities needed in the next decade are discussed.","http://surveygizmoresponseuploads.s3.amazonaws.com/fileuploads/623127/4458621/249-4b11d7bdbcd3320f5f8993f735461ece_OjhaRoopesh.pdf"
"478","11 March 2019 4:18:26 pm","Monica","Colpi","University of Milan","The Gravitational View of Massive Black Hole Mergers","Note: this is to replace the earlier ColpiMonica.pdf submission, having forgotten to include several authors. Apologies.","http://surveygizmoresponseuploads.s3.amazonaws.com/fileuploads/623127/4458621/198-8e2c09ffaaf23d142b84ef43efc943d6_ColpiMonica.pdf"
"479","11 March 2019 4:18:31 pm","Scott","Wolk","Smithsonian Astrophysical Observatory","Understanding Galactic Star Formation with Next Generation X-ray Spectroscopy and Imaging","To address problems in the field of star formation adequately, astronomers in the 2030's  will require a new X-ray  telescope with arc-second imaging and of order 10,000 cm^2 collecting area.  This will enable us a community to keep up with the advances which will be enabled by facilities already in development for the 2020s.","http://surveygizmoresponseuploads.s3.amazonaws.com/fileuploads/623127/4458621/130-c18548170224459c002d4f539d82e045_GalacticStarFormation_s.pdf"
"480","11 March 2019 4:18:50 pm","Rachel","Osten","Space Telescope Science Institute, Johns Hopkins University","Advancing Understanding of Star-Planet Ecosystems in the Next Decade: The Radio Wavelength Perspective","In this white paper we advocate for stellar radio observations as a way to advance understanding of stars in service of a better understanding of star-planet ecosystems. Specific key advances needed are sensitivity and access to a broader range of frequency space to make progress in understanding the space weather environments of exoplanets.","http://surveygizmoresponseuploads.s3.amazonaws.com/fileuploads/623127/4458621/100-139b3f3fb3cf746f0e8749a2c683119e_OstenRachelA2.pdf"
"481","11 March 2019 4:19:06 pm","Natalie","Hinkel","Southwest Research Institute","Stellar Characterization Necessary to Define Holistic Planetary Habitability","It is a truism that “to know the planet, you must know the star.” We discuss important stellar characteristics that require attention in upcoming ground- and space-based missions, such that their processes can be either detangled from that of the planet, correlated with the presence of a planet, or utilized in lieu of direct planetary observations.","http://surveygizmoresponseuploads.s3.amazonaws.com/fileuploads/623127/4458621/64-084d28143eb74dd902cf3259b69e6444_HinkelNatalieR.pdf"
"482","11 March 2019 4:19:10 pm","Philip","Chang","University of Wisconsin - Milwaukee","Cyberinfrastructure Requirements to Enhance Multi-messenger Astrophysics","We outline the cyberinfrastructure requirements to enhance multi-messenger astrophysics and argue for a distributed cyberinfrastructure institute for multimessenger astrophysics to meet these challenges and take advantages of the associate opportunities.","http://surveygizmoresponseuploads.s3.amazonaws.com/fileuploads/623127/4458621/28-91d8e6b9802bf3e7b01eea514dd80550_ChangPhilip.pdf"
"483","11 March 2019 4:20:25 pm","Xavier","Siemens","University of Wisconsin -- Milwaukee","Physics Beyond the Standard Model With Pulsar Timing Arrays","Pulsar timing arrays provide a rare opportunity to probe exotic physics. Potential sources of gravitational waves (GWs) in the nanohertz band include cosmic strings,  inflation, and early universe phase transitions. GW observations will also make possible new tests of gravitational theories and provide a means to probe certain dark matter models. ","http://surveygizmoresponseuploads.s3.amazonaws.com/fileuploads/623127/4458621/137-64740a44cec45a09a10c74149218dd8d_SiemensXavier.pdf"
"484","11 March 2019 4:20:50 pm","Geoffrey","Bower","ASIAA","Fundamental Physics with Galactic Center Pulsars","Pulsars in the Galactic Center are important probes of General Relativity, star formation,  stellar dynamics, and  stellar evolution, the ISM, and the supermassive black hole accretion flow.   A pulsar in orbit around Sgr A* will characterize  black hole physics and GR at sensitivities orders of magnitude better than any other method.   ","http://surveygizmoresponseuploads.s3.amazonaws.com/fileuploads/623127/4458621/132-023bebbd02ae6844da33d6b989f4a712_BowerGeoffreyC.pdf"
"485","11 March 2019 4:21:00 pm","Matthew","Hosek","UCLA","Star Formation in Different Environments: The Initial Mass Function","We discuss new opportunities for measuring the Initial Mass Function across a wide range of environments in the coming decade with JWST, WFIRST, and thirty-meter class telescopes. ","http://surveygizmoresponseuploads.s3.amazonaws.com/fileuploads/623127/4458621/64-c730803764f2311ec4ce4820ed5f71cc_HosekMatthewW.pdf"
"486","11 March 2019 4:21:06 pm","George","Becker","University of California, Riverside","Studying the Reionization Epoch with QSO Absorption Lines","We present opportunities over the coming decade for using QSO absorption lines to study the epoch of reionization.  We emphasize the role of optical and near-infrared spectroscopy with ELTs and JWST, and note synergies with QSO surveys, redshifted 21 cm experiments, and galaxy studies with ALMA, JWST, and WFIRST.","http://surveygizmoresponseuploads.s3.amazonaws.com/fileuploads/623127/4458621/64-435d6ba0718aec5a74e0de3ebb77f8d3_BeckerGeorgeD.pdf"
"487","11 March 2019 4:21:16 pm","Rachel","Friesen","National Radio Astronomy Observatory","Star-Forming Filaments and Cores in Molecular Clouds","Dense, star-forming gas in molecular clouds is dominated by filamentary structures. We describe the best probes of the dynamics of filaments and cores in nearby star-forming molecular clouds, and our recommendations for furthering our understanding of star formation physics through observations over the next decade.","http://surveygizmoresponseuploads.s3.amazonaws.com/fileuploads/623127/4458621/54-736b123d314f5922e093f67c7bee632f_FriesenRachelK.pdf"
"488","11 March 2019 4:22:21 pm","Fabian","Walter","MPIA/NRAO","The evolution of the cosmic molecular gas density","This work outlines the importance of cold gas surveys throughout cosmic history, and their prospects to revolutionize studies of galaxy evolution over the coming decade(s).","http://surveygizmoresponseuploads.s3.amazonaws.com/fileuploads/623127/4458621/184-fd6b5959f2b47323aeafea12190be081_WalterFabian.pdf"
"489","11 March 2019 4:45:04 pm","Steve","Bryson","NASA Ames Research Center","Making Exoplanet Surveys Useful for Statistical Population Studies","In this white paper we discuss what kind of information surveys can provide to facilitate statistical analysis that reveals properties of true exoplanet populations.  We will gather lessons from various surveys and discuss how diverse and independent surveys can provide data that supports statistical inference.  We make several recommendations.","http://surveygizmoresponseuploads.s3.amazonaws.com/fileuploads/623127/4458621/188-41d4dd032082f3cac3d633f065b64d56_BrysonSteveT.pdf"
"490","11 March 2019 4:22:54 pm","Nissim","Fraija","Instituto de Astronomia, UNAM, Mexico","53 of 150","In this paper,  we review the importance to have a wide field-of-view TeV gamma-ray observatory with a large duty cycle  in order to study Active Galactic Nuclei (AGN) phenomena at very-high energies (photons with energies larger than 100 GeV).  We focus in blazars, a special sub-class of AGN. ","http://surveygizmoresponseuploads.s3.amazonaws.com/fileuploads/623127/4458621/188-2a974471014d31fb07d29361e20d219c_Decadal_AGN_NFraija.pdf"
"491","11 March 2019 4:23:02 pm","Alycia","Weinberger","Carnegie DTM","A Strategy for Understanding Planet Formation","This white paper argues for a  pan-chromatic approach to understanding planet formation including observations from X-rays through radio. Planet formation research seeks to address: where planets form in circumstellar disks, how material is transported through the disk and into planets, and how disks evolve in concert with their stars and planets.","http://surveygizmoresponseuploads.s3.amazonaws.com/fileuploads/623127/4458621/250-ba5d33987b37960e2f42612c58835d0d_WeinbergerAlyciaJ.pdf"
"492","11 March 2019 4:23:02 pm","James","Braatz","NRAO","H2O Megamaser Cosmology with the ngVLA","A local measurement of the Hubble Constant at z << 0.5 provides the strongest complement to observations of the CMB for constraining models of dark energy and testing the standard cosmological model.  This white paper describes how the ngVLA can contribute to measuring H0 to a precision of one percent using the H2O megamaser method.","http://surveygizmoresponseuploads.s3.amazonaws.com/fileuploads/623127/4458621/132-017518f12f1de50623b43fac5557835e_BraatzJamesA.pdf"
"493","11 March 2019 4:23:37 pm","James","Cordes","Cornell University","Gravitational Waves, Extreme Astrophysics, and Fundamental Physics with Precision Pulsar Timing","This white paper outlines a pulsar timing program that will provide precision masses of neutron stars, stringent tests of General Relativity, and the detectors for light-year wavelength gravitational wave astronomy and astrophysics:  millisecond pulsars, nature's most precise clocks.   ","http://surveygizmoresponseuploads.s3.amazonaws.com/fileuploads/623127/4458621/37-5fe3ca0038a60c3bfdf681060e5a47b8_CordesJamesM.pdf"
"494","11 March 2019 4:23:39 pm","Amy","Lovell","Agnes Scott College","Ground-based Observations of Small Solar System Bodies:  Probing Our Local Debris Disk","Comets and asteroids are a window into the formation, evolution, and dynamic environment of our solar system, an end-state of debris disks that we can only study from afar.   Long-wavelength radio ground-based observations of asteroids and comets provide an excellent complement to shorter-wavelength observations both from the ground and from space.","http://surveygizmoresponseuploads.s3.amazonaws.com/fileuploads/623127/4458621/250-f8c4de955dff9a36d9e9daa4a9cf7488_LovellAmyJ.pdf"
"495","11 March 2019 4:23:59 pm","Rogier","Windhorst","Arizona State University","On the observability of individual Population III stars and their stellar-mass black hole accretion disks through cluster caustic transits","We discuss if Pop III stars and accretion disks around stellar-mass black holes at z>7 may be directly observable to JWST and the next generation 25-39 meter ground-based telescopes through cluster caustic transits. About 3-30 of the best lensing clusters need to be monitored several times a years for several years to directly detect this.","http://surveygizmoresponseuploads.s3.amazonaws.com/fileuploads/623127/4458621/188-9582db7261318b5dbd905b4701df651d_windhorstPopIIICausticTransitsv4.pdf"
"496","11 March 2019 4:24:21 pm","Tonia","Venters","NASA Goddard Space Flight Center","Energetic Particles of Cosmic Accelerators II: Active Galactic Nuclei and Gamma-ray Bursts","This white paper is the first of a two-part series highlighting the most well-known high-energy cosmic accelerators and contributions that MeV gamma-ray astronomy will bring to understanding their energetic particle phenomena. This white paper discusses active galactic nuclei and gamma-ray bursts.","http://surveygizmoresponseuploads.s3.amazonaws.com/fileuploads/623127/4458621/198-2f0549843dce50cc032c595435ca7e36_VentersToniaM.pdf"
"497","11 March 2019 4:24:25 pm","Joel","Bregman","University of Michigan","A Survey of Hot Gas in the Universe","A large fraction of the baryons and most of the metals in the Universe remain unaccounted.   Their kinematic signatures hold critical insights to the processes of galaxy formation in extended group halos, galaxy groups, and the cosmic web.   We present why grating spectrometers are essential instruments for future X-ray missions.    ","http://surveygizmoresponseuploads.s3.amazonaws.com/fileuploads/623127/4458621/185-605f6734ad562eabc1c8bac7faa9a5d3_Bregman_X_ray_Absorption_%289%29.pdf"
"498","11 March 2019 4:24:55 pm","Nienke","van der Marel","NRC Herzberg Astronomy & Astrophysics programs","Dust growth and dust trapping in protoplanetary disks with the ngVLA","ALMA reveals structures in protoplanetary disks that indicate dust trapping as an important mechanism in the planet formation process, but interpretation is limited due to the optically thick mm emission. The next-generation Very Large Array (ngVLA) will open up the possibilities to study dust growth in disks in optically thin cm wavelengths.","http://surveygizmoresponseuploads.s3.amazonaws.com/fileuploads/623127/4458621/100-5aa76126060004ef0f9f0d4108be0450_vanderMarelNienke.pdf"
"499","11 March 2019 4:25:43 pm","David","Shoemaker","Massachusetts Institute of Technology","Gravitational wave astronomy with LIGO and similar detectors in the next decade","We describe the plans for gravitational-wave observations and astrophysics that will be carried out in the next decade using data from the LIGO Observatories in the US and sister facilities abroad. We provide an overview of gravitational wave signal types that we are targeting, and the role of gravitational waves in multi-messenger astronomy.","http://surveygizmoresponseuploads.s3.amazonaws.com/fileuploads/623127/4458621/64-7f6f9f01aafd853aaffa8b214b653fa6_ShoemakerDavid.pdf"
"500","11 March 2019 4:25:50 pm","Jason","Hogan","Stanford University","Gravitational Waves in the Mid-band with Atom Interferometry","We discuss the science possibilities for gravitational wave astronomy in the mid-band frequency range (30 mHz to 10 Hz) in the context of the MAGIS proposal.  The discovery potential of such instrumentation appears exciting, ranging from observation of new astrophysical and cosmological sources, as well as searches for ultralight dark matter.","http://surveygizmoresponseuploads.s3.amazonaws.com/fileuploads/623127/4458621/118-6deddc1c342c9e6ed2d25cb5fb329734_HoganJasonM.pdf"
