"Response ID","Date Submitted","First Name:Principal Author","Last Name:Principal Author","Institution of Principal Author:Principal Author","White Paper Title","White Paper Description (350 character limit)","1:Upload File  "
"7","22 January 2019 12:00:08 pm","Daniel","Weisz","University of California, Berkeley","Near-Field Cosmology with the Lowest-Mass Galaxies","We present an overview of near-field cosmology and make recommenations for future progress. The study of nearby low-mass galaxies on a star-by-star basis has implications that extend far beyond the local Universe and include the nature of dark matter, lives and deaths of the first stars, cosmic reionization, and galaxy formation across cosmic time.","http://surveygizmoresponseuploads.s3.amazonaws.com/fileuploads/623127/4458621/249-d855019a19f08bbb8c93d3133407fd04_WeiszDaniel.pdf"
"8","7 February 2019 4:14:39 pm","Frank","Timmes","Arizona State University","Catching Element Formation In The Act ; The Case for a New MeV Gamma-Ray Mission: Radionuclide Astronomy in the 2020s","Gamma-ray astronomy explores the most energetic photons in nature to address some of the most pressing puzzles in contemporary astrophysics. The unique information provided by MeV gamma-ray astronomy to help address frontiers makes now a compelling time for the community to advocate for a new mission to be operational in the 2020s and beyond.","http://surveygizmoresponseuploads.s3.amazonaws.com/fileuploads/623127/4458621/118-67aa9f7d04d7bb408a3881b53afc8a5e_TimmesFrankX.pdf"
"9","10 February 2019 8:19:56 pm","J. Craig","Wheeler","The University of Texas at Austin","ELT Contributions to The First Explosions","We describe the potential for using Type Ia supernovae, pair instability supernovae, superluminous supernovae, and gamma-ray bursts to probe the first explosions and hence first stars in the Universe with a US-ELT System.","http://surveygizmoresponseuploads.s3.amazonaws.com/fileuploads/623127/4458621/184-d5d7a92c2b2005bcda972350356e911a_WheelerJCraig.pdf"
"10","10 February 2019 8:27:59 pm","J. Craig","Wheeler","The University of Texas at Austin","ELT Contributions to Tidal Disruption Events","A US-ELT system with its large aperture and sensitive optical and near infrared imager spectrographs will make major contributions to the study of stars ripped apart by supermassive black holes. ","http://surveygizmoresponseuploads.s3.amazonaws.com/fileuploads/623127/4458621/64-0b6d460b8400cc667f3ebae6e377a50c_WheelerJCraig%282%29.pdf"
"11","15 February 2019 10:23:33 pm","Hantao","Ji","Princeton University","Major Scientific Challenges and Opportunities in Understanding Magnetic Reconnection and Related Explosive Phenomena throughout the Universe","This is a group white paper of 100 authors (each with explicit permission via email) from 51 institutions on the topic of magnetic reconnection which is relevant to 6 thematic areas. Grand challenges and research opportunities are described in observations, numerical modeling and laboratory experiments in the upcoming decade.","http://surveygizmoresponseuploads.s3.amazonaws.com/fileuploads/623127/4458621/132-61b64dfdc75fe83124ba902d69e2324d_Ji-reconnection-astro2020-final.pdf"
"12","16 February 2019 12:47:46 pm","Jack","Burns","University of Colorado Boulder","Dark Cosmology: Investigating Dark Matter & Exotic Physics in the Dark Ages using the Redshifted 21-cm Global Spectrum","The Dark Ages, probed by the redshifted 21-cm signal, is the ideal epoch for a new rigorous test of the standard ΛCDM cosmological model. Divergences from that model would indicate new physics, such as dark matter decay (heating) or baryonic cooling beyond that expected from adiabatic expansion of the Universe.","http://surveygizmoresponseuploads.s3.amazonaws.com/fileuploads/623127/4458621/195-d20d49952f5d9b7af87492221bc1ac89_BurnsJackO.pdf"
"13","16 February 2019 11:06:25 pm","david","sheikh","ZeCoat Corporation","Method to aluminum-coat telescope mirrors in space for EUV-broadband astronomy","Telescope mirrors and gratings coated on-orbit with bare aluminum may allow broadband observations that include the EUV band between 30-nm and 100-nm and would have broadband coverage from the EUV through the long IR. High-discharge lithium battery technology exists today to build a large, self-coating telescope in space.     ","http://surveygizmoresponseuploads.s3.amazonaws.com/fileuploads/623127/4458621/118-e192d81b5b5ba23990d5de149c9bccee_SheikhDavidA.pdf"
"14","17 February 2019 4:55:16 pm","Michael","Fundator","Rutgers University","Galileo Galilei versus Aristotle, Philosophy of motion, Galileo’s  contemporaries, very large numbers, Fermat’s Last Theorem, and speed of light.","Galileo’s opposition to Aristotle’s concepts of motion developed into square dependence in the philosophical thought on kinematics and dynamics, Galileo’s transformation and concepts including infinite, theory of motion,   analytical geometry, measurement of speeds of light and sound, theory of numbers with focus on very large numbers. ","http://surveygizmoresponseuploads.s3.amazonaws.com/fileuploads/623127/4458621/250-ad57d859f5c9a7fa688af62831af3bd3_AstroWhitePaper.pdf"
"15","18 February 2019 3:31:32 am","Ashwini","Sathnur","United Nations Development Programme","Solar flares and Quantum Neural Networks","Introduction of new technologies on the conceptual ideologies of Accessibility.   This white paper describes the innovative themes of solar flares and the realization of implementation of new technologies.   The human  astronauts end users are located in the space regions where there could be incidents of exposure to the solar flares and the radiation.","http://surveygizmoresponseuploads.s3.amazonaws.com/fileuploads/623127/4458621/184-b35505d0813dd574247847c4e2c09a78_SathnurAshwini.docx"
"16","18 February 2019 8:05:24 am","Michael","Eracleous","The Pennsylvania State University","An Arena for Multi-Messenger Astrophysics: Inspiral and Tidal Disruption of White Dwarfs by Massive Black Holes","Tidal disruptions of white dwarfs by intermediate-mass black holes can inform us of black hole demographics, stellar populations and dynamics in their vicinity, and the physics of accretion. We can harness the information with a combination of surveys surveys for electromagnetic observatories and low-frequency gravitational wave observations.","http://surveygizmoresponseuploads.s3.amazonaws.com/fileuploads/623127/4458621/185-3c866021fec76c0e4465bc2211ccdc96_LISA_WD_current.pdf"
"17","18 February 2019 4:05:47 pm","George","Rieke","University of Arizona","JWST/MIRI Surveys in GOODS-S","JWST/MIRI GTO programs in GOODS-S will (1) measure obscured star formation rates down to 10 Mʘ/yr; (2) measure aromatic band strengths to constrain processes in galaxy ISMs; (3)  complete our inventory of AGN types;  (4)  improve mass estimates for galaxies at z > 4; and (5)  help determine masses and ages of young stellar populations at z > 8.  ","http://surveygizmoresponseuploads.s3.amazonaws.com/fileuploads/623127/4458621/137-491e2e58e3d6bb2f81c77d1db5f6890b_RiekeGeorgeH.pdf"
"18","19 February 2019 4:13:14 pm","Mikako","Matsuura","Cardiff University","Dust in supernovae: --- Do supernovae produce the first dust in the Universe? Are supernovae the key dust producers of galaxies?","This contribution is to describe why studies of dust in supernova can be important, and how this research field can develop in the next decade.","http://surveygizmoresponseuploads.s3.amazonaws.com/fileuploads/623127/4458621/132-39ccbfb67271364caf41ee339f17b090_SNdust_ver4.pdf"
"19","21 February 2019 4:59:29 pm","Ravi kumar","Kopparapu","NASA Goddard Space Flight Center","Exoplanet Diversity in the Era of Space-based Direct Imaging Missions","This whitepaper discusses the diversity of exoplanets that could be detected by future observations  in the upcoming era of large space-based flagship missions. The primary focus will be on characterizing Earth-like worlds around Sun-like stars. However, we will also be able to characterize companion planets in the system simultaneously. ","http://surveygizmoresponseuploads.s3.amazonaws.com/fileuploads/623127/4458621/249-bebfe1e9266559a848628ecd924fe448_KopparapuRavikumar.pdf"
"20","21 February 2019 10:29:43 pm","Todd","Hunter","National Radio Astronomy Observatory","Understanding Accretion Outbursts in Massive Protostars through Maser Imaging","Two recent extraordinary accretion outbursts in massive protostars, both heralded by maser flares, have impacted our view of star formation. Unraveling the accretion mechanism in such deeply-embedded systems requires larger, more sensitive centimeter wavelength interferometers to image the masing molecular gas simultaneously with the ionized gas.","http://surveygizmoresponseuploads.s3.amazonaws.com/fileuploads/623127/4458621/198-b2d2819d64ed471c77ebd4b23f4589cd_HunterToddR.pdf"
"21","22 February 2019 10:29:11 am","Michelle","Ntampaka","Harvard Data Science Initiative; Center for Astrophysics | Harvard & Smithsonian","The Role of Machine Learning in the Next Decade of Cosmology","Machine learning (ML) methods have remarkably improved how cosmologists can interpret data. The next decade will bring new opportunities for data-driven discovery, but will also present new challenges for adopting ML methodologies. ML could transform our field, but it will require the community to promote interdisciplinary research endeavors.","http://surveygizmoresponseuploads.s3.amazonaws.com/fileuploads/623127/4458621/96-9d26fecaf818795b66a7fde473c05dcb_NtampakaMichelleC.pdf"
"22","23 February 2019 2:20:31 pm","Jonathan","Lunine","Cornell University","Comparing key compositional indicators in  Jupiter with those in extra-solar giant planets.","James Webb Space Telescope will enable detailed analysis of molecular abundances, including but  not limited to all the major carbon- and oxygen-bearing species in hot  Jupiter atmospheres. This will allow determination of the carbon-to-oxygen ratio, an essential number for planet formation models and allowing comparison with Juno’s value for Jupiter.","http://surveygizmoresponseuploads.s3.amazonaws.com/fileuploads/623127/4458621/54-4bc8f3fe7e54542a9ff69c8e666fb3c4_luninejonathani.pdf"
"23","26 February 2019 5:45:35 pm","Eric","Perlman","Florida Institute of Technology","Relativistic Jets in the Accretion & Collimation Zone :  New Challenges Enabled by New Instruments","We point out advances that can be achieved by new technology in the zone where AGN jets are accelerated to relativistic speeds and collimated.  The ngVLA, near-IR, near-IR, optical and X-ray interferometry, and other projects can produce fundamental advances in understanding jet production, acceleration, collimation and high-energy phenomena.","http://surveygizmoresponseuploads.s3.amazonaws.com/fileuploads/623127/4458621/100-04dbc331cc5cfc08c17bd6b2dc24ec0b_PerlmanEricS_1.pdf"
"25","1 March 2019 8:38:16 am","Michael","Kurtz","Center for Astrophysics | Harvard & Smithsonian","From Dark Energy to Exolife: Improving the Digital Information Infrastructure for Astrophysics","A robust information infrastructure is needed to meet future research challenges. The scientific literature can be used as the central organizing point used to navigate interdisciplinary research fields.  Connecting the literature with data products increases discoverability of both and allows for the data to be more accessible by non-experts.","http://surveygizmoresponseuploads.s3.amazonaws.com/fileuploads/623127/4458621/28-19fa6a446117854dde9a9fbe09939ee5_KurtzMichaelJ.pdf"
"26","1 March 2019 7:33:12 pm","Roser","Juanola-Parramon","NASA GSFC/UMBC","Solar System Science with Space Telescopes","Building on the legacy of HST and other space telescopes, a large multi-wavelength space observatory would enable transformative advances in planetary science. Here we highlight several representative areas of Solar System science that would greatly benefit from high resolution UV/Opt/NIR imaging (Venus, Jupiter, Neptune, dwarf planets and KBOs).","http://surveygizmoresponseuploads.s3.amazonaws.com/fileuploads/623127/4458621/54-f72d7d34b43b19d6ef0fad6fd955169c_JuanolaParramonRoser.pdf"
"27","2 March 2019 9:11:28 pm","Imke","de Pater","UC Berkeley","Potential for Solar System Science with the ngVLA: the Giant Planets","Radio wavelength observations of solar system bodies are a powerful method of probing the deep atmospheres of the giant planets, its rings, and magnetospheres. The ngVLA will enable the highest sensitivity and resolution observations of this kind, with the potential to revolutionize our understanding of these bodies.","http://surveygizmoresponseuploads.s3.amazonaws.com/fileuploads/623127/4458621/184-539f311c296179a22c44c21beaef54e8_DePaterImke.pdf"
"29","4 March 2019 10:02:05 am","Andrew","Fox","Space Telescope Science Institute","The Magellanic Stream as a Probe of Astrophysics","The Magellanic Stream is the most spectacular example of a gaseous stream in the local Universe.  In this white paper, we emphasize the Stream’s importance for many areas of Galactic astronomy, summarize key unanswered questions, and identify future observations and simulations needed to resolve them.  ","http://surveygizmoresponseuploads.s3.amazonaws.com/fileuploads/623127/4458621/195-4f5fae748e5e1dd490f0210f0f3bd0d6_mag-stream.pdf"
"30","4 March 2019 10:10:24 am","Andrew","Fox","Space Telescope Science Institute","Spectroscopic Observations of the Fermi Bubbles","The Fermi Bubbles are two giant plasma lobes extending 10 kpc above and below the Galactic Center. Here we identify the scientific themes that have emerged from spectroscopic studies of the Bubbles, determine key open questions, and describe the observations needed in the next decade to characterize the nuclear wind and its impact on the Galaxy. ","http://surveygizmoresponseuploads.s3.amazonaws.com/fileuploads/623127/4458621/100-017bd9cf7bd7951eae13b6e0381e23de_fermi-bubble.pdf"
"31","4 March 2019 5:19:18 pm","Heidi","Hammel","AURA","Solar System Science with the James Webb Space Telescope","NASA’s space telescopes advance Solar System exploration in ways that complement in situ planetary spacecraft. As an example, we review some of the Solar System science planned for the James Webb Space Telescope. We envision similar robust planetary science cases for other future astrophysics flagships, particularly LUVOIR.","http://surveygizmoresponseuploads.s3.amazonaws.com/fileuploads/623127/4458621/54-2b59661ef903906f243eab03168a44a9_HammelHeidiB_Webb.pdf"
"32","4 March 2019 5:43:12 pm","Slava","Turyshev","Jet Propulsion Laboratory, Californa Institute of Technology","Direct Multi-Pixel Imaging and Spatially-Resolved Spectroscopy of a Potentially Habitable Exoplanet with the Solar Gravitational Lens","Direct high-resolution investigations of a potentially habitable exoplanet may result in finding extra-terrestrial life. This can be achieved with a telescope at the focal region of the Solar Gravitational Lens.  Resulting facility is the only practical way to achieve a multi-pixel image at a km-scale resolution on the surface of an exoplanet. ","http://surveygizmoresponseuploads.s3.amazonaws.com/fileuploads/623127/4458621/54-1f6e4807ea81e194122b05872c820dbe_TuryshevSlavaG.pdf"
"33","5 March 2019 11:18:22 am","Lynne","Valencic","Johns Hopkins University","Probing the Structure of Interstellar Dust from Micron to Kpc Scales with X-ray Imaging","This White Paper explores the impact that the next generation of X-ray imagers will have on constraining interstellar dust grain models and improving our understanding of the physical processes that dictate how grains evolve over their lifetimes. ","http://surveygizmoresponseuploads.s3.amazonaws.com/fileuploads/623127/4458621/184-9c0e58dfd69be80cbaaa905f03af45b9_ValencicLynne.pdf"
"34","5 March 2019 11:59:38 am","Bradford","Snios","Center for Astrophysics | Harvard & Smithsonian","X-rays Studies of the Solar System","X-ray observatories advance Solar System studies by probing  Sun-object  interactions, developing surface composition maps, probing magnetospheric dynamics, and tracking astrochemical reactions. Implementing modern X-ray optics in future instruments will foster a truly transformative era of Solar System science through the study of X-ray emission.","http://surveygizmoresponseuploads.s3.amazonaws.com/fileuploads/623127/4458621/195-f2559f608b9b4e8bb1d5105320796f84_SniosBradfordT.pdf"
"35","5 March 2019 12:08:44 pm","Mark","Heyer","University of Massachusetts, Amherst","Far Infrared Spectroscopic Imaging of the Neutral Interstellar Medium in Galaxies","We describe the importance of obtaining velocity-resolved far-infrared emission lines to investigate the thermodynamics of the neutral ISM, the assembly of giant molecular clouds, interstellar turbulence, and radiative feedback.  ","http://surveygizmoresponseuploads.s3.amazonaws.com/fileuploads/623127/4458621/64-3a7994b8c337821ae3a9661e413ff2c9_HeyerMark.pdf"
"37","6 March 2019 2:23:19 pm","Dheeraj","Pasham","Massachusetts Institute of Technology","Probing the Cosmological Evolution of Super-massive Black Holes using Tidal Disruption Flares","X-ray spectral-timing studies of tidal disruption events to build a census of supermassive black hole spins at various redshifts and  study super-Eddington accretion around supermassive black holes in the local Universe to understand how they may have grown at high redshifts.","http://surveygizmoresponseuploads.s3.amazonaws.com/fileuploads/623127/4458621/238-bf0b00cb07c3b239339972bf6f31b0e2_DheerajPashamR.pdf"
"38","6 March 2019 4:28:39 pm","Scott","Wolk","Smithsonian Astrophysical Observatory","X-ray Studies of Exoplanets","We discuss contributions to the study of exoplanets and their environs which can be made by X-ray data of increasingly high quality that are achievable in the next 10--15 years.","http://surveygizmoresponseuploads.s3.amazonaws.com/fileuploads/623127/4458621/188-105278f5463ca9a05eedfde0d8632b66_WolkScottJ.pdf"
"39","6 March 2019 4:55:34 pm","Joan","Wrobel","National Radio Astronomy Observatory","Intermediate-Mass Black Holes in Extragalactic Globular Clusters","Intermediate-mass black holes have masses of ~ 100 to 100,000 Msun.  Finding them in globular clusters would validate a formation channel for seed black holes in the early universe and inform event predictions for gravitational wave facilities.  Searching many globular clusters is key,  and only feasible using a next-generation Very Large Array.","http://surveygizmoresponseuploads.s3.amazonaws.com/fileuploads/623127/4458621/54-f77d9b78a792b8229b33943040711304_WrobelJoanM.pdf"
"40","6 March 2019 10:28:26 pm","Brant","Robertson","UC Santa Cruz and Institute for Advanced Study","Understanding Galaxy Formation via Near-Infrared Surveys in the 2020s","A discussion of science cases in extragalactic astrophysics and galaxy formation that wide-area space-based infrared surveys will address in the 2020s.","http://surveygizmoresponseuploads.s3.amazonaws.com/fileuploads/623127/4458621/250-a3e3365e48448a9a45b7b0d63268579d_RobertsonBrantE.pdf"
"41","6 March 2019 11:35:39 pm","Ramses","Ramirez","Earth-Life Science Institute (ELSI), Tokyo Institute of Technology","Habitable zone predictions and how to test them","The classical HZ definition makes a number of assumptions common to the Earth. We discuss these and the observations needed to test them.  We also discuss how next-generation missions are only the beginning of a much more data-filled era in the near future, allowing us to actually determine which planets are most likely to exhibit life.","http://surveygizmoresponseuploads.s3.amazonaws.com/fileuploads/623127/4458621/64-2dc3fcc201a3075e3da6233f1a91c668_RamirezRamsesM.pdf"
"42","7 March 2019 4:11:50 am","Emanuele","Berti","Johns Hopkins University","Tests of General Relativity and Fundamental Physics with Space-based Gravitational Wave Detectors","Low-frequency gravitational-wave astronomy can perform precision tests of general relativity and probe fundamental physics in a regime previously inaccessible. A space-based detector will be a formidable tool to explore gravity and some of the greatest mysteries in physics and astronomy, such as dark matter and the origin of the Universe.","http://surveygizmoresponseuploads.s3.amazonaws.com/fileuploads/623127/4458621/64-4ae197dc5d06f07f39a36d5f80d57999_BertiEmanuele.pdf"
"43","7 March 2019 5:48:57 am","Luca","Fossati","Space Research Institute, Austrian Academy of Sciences","Ultraviolet Spectropolarimetry as a Tool for Understanding the Diversity of Exoplanetary Atmospheres","We show that a high-resolution spectropolarimeter with a broad wavelength coverage, particularly if attached to a large space telescope, would enable simultaneous study of the polarimetric exoplanet properties of the continuum and to look for and characterize the polarimetric signal due to scattering from single molecules.","http://surveygizmoresponseuploads.s3.amazonaws.com/fileuploads/623127/4458621/37-941c3514f99090e2cf1429e493313d29_FossatiLuca.pdf"
"44","7 March 2019 6:11:01 am","Tyson","Littenberg","NASA Marshall Space Flight Center","GRAVITATIONAL WAVE SURVEY OF GALACTIC ULTRA COMPACT BINARIES","Summary of science yield from joint GW and EM surveys of ultracompact binaries in the galaxy, including studies of the population as a whole and the dynamics of individual systems.","http://surveygizmoresponseuploads.s3.amazonaws.com/fileuploads/623127/4458621/188-60a2a4a52dc40c70d01299ccc2adfae9_LittenbergTysonB.pdf"
"45","7 March 2019 8:54:43 am","Elena","Gallo","University of Michigan","Towards a high accuracy measurement of the local black hole occupation fraction in low mass galaxies","This document illustrates the feasibility of a few per cent level measurement of the local black hole occupation fraction in low mass galaxies through wide-field, high angular resolution X-ray imaging observations of local volume galaxies. ","http://surveygizmoresponseuploads.s3.amazonaws.com/fileuploads/623127/4458621/28-c1122a8dd2bdd9da2c8c9818a6633948_GalloElena.pdf"
"46","7 March 2019 9:23:38 am","Adam","Frank","University of Rochester","Exoplanets and High Energy Density Plasma Science","In this white paper we review the state of exoplanet interior studies and the ability of High Energy Density Plasma (HEDP) WDM techniques to address critical open issues.","http://surveygizmoresponseuploads.s3.amazonaws.com/fileuploads/623127/4458621/195-f4928c3c8fd50862e897559689f198c0_Frank_Astro_Decadal_White_Paper.pdf"
"47","7 March 2019 10:55:33 am","Alexander","Kashlinsky","Goddard Space Flight Center","Populations behind the source-subtracted cosmic infrared background anisotropies","Source-subtracted CIB fluctuations cannot be explained by known galaxy populations and  appear highly coherent with unresolved CXB from significantly abundant accreting BHs. Characterizing the CIB with high accuracy, and constraining the nature of the new populations would produce critically important cosmological information in the next decade. ","http://surveygizmoresponseuploads.s3.amazonaws.com/fileuploads/623127/4458621/100-a47659f7d3404b9768f1bfab6ae67550_whitepaper_cib.pdf"
"48","7 March 2019 1:45:27 pm","Eric","Burns","NASA Goddard","A Summary of Multimessenger Science with Neutron Star Mergers","The white paper discusses the breadth of science that is possible with multimessenger observations of neutron star mergers. It then makes recommendations for the next decade, then beyond, to be sure we capture this science.","http://surveygizmoresponseuploads.s3.amazonaws.com/fileuploads/623127/4458621/132-170cb32d605fd6642b637e8165593039_BurnsEricK.pdf"
"50","7 March 2019 4:44:14 pm","Marusa","Bradac","UC Davis","Spectroscopic Probes of Galaxies at the Epoch of Reionization","While JWST will revolutionize the study of galaxies at the epoch of reionization, several questions will remain unanswered even after the data is taken.  ELTs will provide a comprehensive picture on the properties of Lyman-alpha emitters, and establish them as one of the main probes of the reionization epoch.   ","http://surveygizmoresponseuploads.s3.amazonaws.com/fileuploads/623127/4458621/137-da97b443ec013df3d5bd12837b7053b7_BradacMarusa.pdf"
"51","7 March 2019 4:51:09 pm","Alice","Pisani","Princeton University","Cosmic voids: a novel probe to shed light on our Universe","In this paper we present the case for void science, arguing that cosmic voids are a novel probe to constrain modified gravity, dark energy, the sum of neutrino masses and galaxy evolution. Voids will answer some of the most relevant questions in cosmology and astrophysics over the next decade. ","http://surveygizmoresponseuploads.s3.amazonaws.com/fileuploads/623127/4458621/100-ab6bf1f100e2cd52dcc56a7626298b2a_PisaniAlice.pdf"
"52","7 March 2019 5:25:41 pm","Christopher","Carilli","NRAO","Imaging molecular gas in high redshift galaxies at <=1 kpc resolution","Imaging the cool molecular gas in distant galaxies, the fuel for star formation, at <= 1kpc resolution, is a prerequisite for future 'precision galaxy formation studies', addressing such basic issues as a Universal 'star formation law', cloud evolution and feed-back, and the dynamics and physical conditions in the cold gas in early galaxies.","http://surveygizmoresponseuploads.s3.amazonaws.com/fileuploads/623127/4458621/37-7e21f5a7a9405af7d3418adfc6b22e3f_CarilliChrisL.pdf"
